{
  "$schema": "https://json-schema.org/draft/2020-12/schema",
  "$id": "https://galeng.local/schema/galeng.project.schema.json",
  "title": "Galeng project (galeng.json)",
  "type": "object",
  "additionalProperties": false,
  "required": [
    "id",
    "title",
    "schemaVersion",
    "resolution",
    "startScene",
    "locale"
  ],
  "properties": {
    "id": {
      "$ref": "#/$defs/nonEmptyString"
    },
    "title": {
      "$ref": "#/$defs/nonEmptyString"
    },
    "schemaVersion": {
      "type": "integer",
      "enum": [
        1,
        2
      ]
    },
    "resolution": {
      "$ref": "#/$defs/resolution"
    },
    "startScene": {
      "$ref": "#/$defs/nonEmptyString"
    },
    "locale": {
      "$ref": "#/$defs/nonEmptyString"
    },
    "skipTitle": {
      "type": "boolean"
    },
    "titleBgm": {
      "$ref": "#/$defs/assetPath"
    },
    "titleBg": {
      "$ref": "#/$defs/assetPath"
    },
    "titleMovie": {
      "$ref": "#/$defs/assetPath"
    },
    "font": {
      "$ref": "#/$defs/assetPath",
      "description": " Deprecated alias for fonts.dialogue."
    },
    "msgBox": {
      "$ref": "#/$defs/assetPath"
    },
    "icon": {
      "$ref": "#/$defs/assetPath"
    },
    "hideGameTitle": {
      "type": "boolean"
    },
    "titleButtons": {
      "$ref": "#/$defs/titleButtons"
    },
    "pauseButtons": {
      "$ref": "#/$defs/pauseButtons"
    },
    "uiLanguages": {
      "type": "array",
      "minItems": 1,
      "items": {
        "enum": [
          "zh-Hans",
          "zh-Hant",
          "en"
        ]
      }
    },
    "characters": {
      "type": "array",
      "items": {
        "$ref": "#/$defs/character"
      }
    },
    "cg": {
      "type": "array",
      "items": {
        "$ref": "#/$defs/galleryItem"
      }
    },
    "musicGallery": {
      "type": "array",
      "items": {
        "$ref": "#/$defs/galleryItem"
      }
    },
    "verbs": {
      "type": "array",
      "items": {
        "$ref": "#/$defs/verb"
      }
    },
    "items": {
      "type": "array",
      "items": {
        "$ref": "#/$defs/itemDef"
      }
    },
    "switches": {
      "type": "array",
      "items": {
        "$ref": "#/$defs/switchDef"
      }
    },
    "fallback": {
      "$ref": "#/$defs/fallback"
    },
    "effectLibrary": {
      "type": "array",
      "items": {
        "$ref": "#/$defs/effectDef"
      }
    },
    "transitionDefaults": {
      "$ref": "#/$defs/transitionDefaults"
    },
    "fonts": {
      "type": "object",
      "additionalProperties": false,
      "properties": {
        "dialogue": {
          "type": "string",
          "minLength": 1
        },
        "ui": {
          "type": "string",
          "minLength": 1
        },
        "title": {
          "type": "string",
          "minLength": 1
        },
        "scale": {
          "type": "object",
          "additionalProperties": false,
          "properties": {
            "dialogueBody": {
              "type": "number"
            },
            "speaker": {
              "type": "number"
            },
            "explorePill": {
              "type": "number"
            },
            "inventory": {
              "type": "number"
            },
            "hud": {
              "type": "number"
            },
            "title": {
              "type": "number"
            },
            "menu": {
              "type": "number"
            },
            "settings": {
              "type": "number"
            }
          }
        }
      }
    }
  },
  "$defs": {
    "nonEmptyString": {
      "type": "string",
      "minLength": 1
    },
    "assetPath": {
      "type": "string",
      "minLength": 1,
      "pattern": "^[A-Za-z0-9]([A-Za-z0-9_/-]*[A-Za-z0-9])?$",
      "description": "Logical path without extension, drive letter, or backslash."
    },
    "resolution": {
      "type": "object",
      "additionalProperties": false,
      "required": [
        "width",
        "height"
      ],
      "properties": {
        "width": {
          "type": "integer",
          "const": 1920
        },
        "height": {
          "type": "integer",
          "const": 1080
        }
      }
    },
    "character": {
      "type": "object",
      "additionalProperties": false,
      "required": [
        "id"
      ],
      "properties": {
        "id": {
          "$ref": "#/$defs/nonEmptyString"
        },
        "display": {
          "type": "object",
          "additionalProperties": {
            "type": "string"
          }
        },
        "textRate": {
          "type": "integer",
          "minimum": 25,
          "maximum": 400
        }
      }
    },
    "galleryItem": {
      "type": "object",
      "additionalProperties": false,
      "required": [
        "id",
        "asset"
      ],
      "properties": {
        "id": {
          "$ref": "#/$defs/nonEmptyString"
        },
        "asset": {
          "$ref": "#/$defs/assetPath"
        }
      }
    },
    "titleButtons": {
      "type": "object",
      "additionalProperties": false,
      "properties": {
        "newGame": {
          "$ref": "#/$defs/titleButton"
        },
        "continue": {
          "$ref": "#/$defs/titleButton"
        },
        "load": {
          "$ref": "#/$defs/titleButton"
        },
        "gallery": {
          "$ref": "#/$defs/titleButton"
        },
        "music": {
          "$ref": "#/$defs/titleButton"
        },
        "settings": {
          "$ref": "#/$defs/titleButton"
        },
        "quit": {
          "$ref": "#/$defs/titleButton"
        }
      }
    },
    "pauseButtons": {
      "type": "object",
      "additionalProperties": false,
      "properties": {
        "continue": {
          "$ref": "#/$defs/titleButton"
        },
        "quickSave": {
          "$ref": "#/$defs/titleButton"
        },
        "quickLoad": {
          "$ref": "#/$defs/titleButton"
        },
        "autoLoad": {
          "$ref": "#/$defs/titleButton"
        },
        "save": {
          "$ref": "#/$defs/titleButton"
        },
        "load": {
          "$ref": "#/$defs/titleButton"
        },
        "settings": {
          "$ref": "#/$defs/titleButton"
        },
        "title": {
          "$ref": "#/$defs/titleButton"
        },
        "quit": {
          "$ref": "#/$defs/titleButton"
        }
      }
    },
    "titleButton": {
      "type": "object",
      "additionalProperties": false,
      "properties": {
        "label": {
          "type": "string"
        },
        "image": {
          "$ref": "#/$defs/assetPath"
        },
        "hover": {
          "$ref": "#/$defs/assetPath"
        },
        "x": {
          "type": "integer"
        },
        "y": {
          "type": "integer"
        },
        "w": {
          "type": "integer",
          "minimum": 1
        },
        "h": {
          "type": "integer",
          "minimum": 1
        }
      }
    },
    "verb": {
      "type": "object",
      "additionalProperties": false,
      "required": [
        "id",
        "label"
      ],
      "properties": {
        "id": {
          "$ref": "#/$defs/nonEmptyString"
        },
        "label": {
          "$ref": "#/$defs/nonEmptyString"
        },
        "builtin": {
          "type": "boolean"
        }
      }
    },
    "itemDef": {
      "type": "object",
      "additionalProperties": false,
      "required": [
        "id",
        "name"
      ],
      "properties": {
        "id": {
          "$ref": "#/$defs/nonEmptyString"
        },
        "name": {
          "$ref": "#/$defs/nonEmptyString"
        },
        "icon": {
          "$ref": "#/$defs/assetPath"
        },
        "desc": {
          "type": "string"
        },
        "consumeOnUse": {
          "type": "boolean"
        }
      }
    },
    "switchDef": {
      "type": "object",
      "additionalProperties": false,
      "required": [
        "id"
      ],
      "properties": {
        "id": {
          "$ref": "#/$defs/nonEmptyString"
        },
        "name": {
          "type": "string"
        },
        "init": {
          "type": "boolean"
        }
      }
    },
    "fallback": {
      "type": "object",
      "additionalProperties": false,
      "properties": {
        "perVerb": {
          "type": "object",
          "additionalProperties": {
            "type": "string"
          }
        },
        "itemOnHotspot": {
          "type": "string"
        },
        "global": {
          "type": "string"
        }
      }
    },
    "effectParams": {
      "type": "object",
      "additionalProperties": false,
      "properties": {
        "ms": {
          "type": "integer",
          "minimum": 0
        },
        "color": {
          "type": "string",
          "pattern": "^#[0-9A-Fa-f]{6}$"
        }
      }
    },
    "effectDef": {
      "type": "object",
      "additionalProperties": false,
      "required": [
        "id",
        "kind"
      ],
      "properties": {
        "id": {
          "$ref": "#/$defs/nonEmptyString"
        },
        "kind": {
          "enum": [
            "fade",
            "crossfade"
          ]
        },
        "params": {
          "$ref": "#/$defs/effectParams"
        }
      }
    },
    "transitionDefaults": {
      "type": "object",
      "additionalProperties": false,
      "properties": {
        "toDialogue": {
          "$ref": "#/$defs/nonEmptyString"
        },
        "fromDialogue": {
          "$ref": "#/$defs/nonEmptyString"
        },
        "gotoScene": {
          "$ref": "#/$defs/nonEmptyString"
        }
      }
    }
  }
}
